{
  "raceId": "FIX-2026-08-04-FIXDOWNS-1440-C4-HURDLE",
  "dataset": "test-fixture",
  "testData": true,
  "source": "test-fixture-generator",
  "sourceUrl": null,
  "retrievedAt": "2026-08-04T17:10:00Z",
  "parserVersion": "fixture-generator-1.0.0",
  "date": "2026-08-04",
  "time": "14:40",
  "course": "Fixdowns (TEST)",
  "courseRegion": "GB",
  "raceType": "Hurdle",
  "isHandicap": true,
  "class": 4,
  "name": "Synthetic Test Handicap Hurdle (Fixture H, jumps excluded)",
  "distance": "2m",
  "going": "Good (fixture)",
  "declaredRunners": 8,
  "actualRunners": 8,
  "resultStatus": "unresolved",
  "resultsRetrievedAt": null,
  "runners": [
    { "runnerNumber": 1, "name": "Fixture Ivy", "status": "runner", "odds": { "fractional": "2/1", "decimal": 3, "capturedAt": "2026-08-04T14:00:00Z" }, "sp": null, "finishPosition": null, "resultStatus": null, "jockey": "Test Jockey A", "trainer": "Test Trainer A" },
    { "runnerNumber": 2, "name": "Fixture Juniper", "status": "runner", "odds": { "fractional": "4/1", "decimal": 5, "capturedAt": "2026-08-04T14:00:00Z" }, "sp": null, "finishPosition": null, "resultStatus": null, "jockey": "Test Jockey B", "trainer": "Test Trainer B" },
    { "runnerNumber": 3, "name": "Fixture Kiwi", "status": "runner", "odds": { "fractional": "6/1", "decimal": 7, "capturedAt": "2026-08-04T14:00:00Z" }, "sp": null, "finishPosition": null, "resultStatus": null, "jockey": "Test Jockey C", "trainer": "Test Trainer C" },
    { "runnerNumber": 4, "name": "Fixture Lemon", "status": "runner", "odds": { "fractional": "8/1", "decimal": 9, "capturedAt": "2026-08-04T14:00:00Z" }, "sp": null, "finishPosition": null, "resultStatus": null, "jockey": "Test Jockey D", "trainer": "Test Trainer D" },
    { "runnerNumber": 5, "name": "Fixture Mango", "status": "runner", "odds": { "fractional": "12/1", "decimal": 13, "capturedAt": "2026-08-04T14:00:00Z" }, "sp": null, "finishPosition": null, "resultStatus": null, "jockey": "Test Jockey E", "trainer": "Test Trainer E" },
    { "runnerNumber": 6, "name": "Fixture Nutmeg", "status": "runner", "odds": { "fractional": "16/1", "decimal": 17, "capturedAt": "2026-08-04T14:00:00Z" }, "sp": null, "finishPosition": null, "resultStatus": null, "jockey": "Test Jockey F", "trainer": "Test Trainer F" },
    { "runnerNumber": 7, "name": "Fixture Olive", "status": "runner", "odds": { "fractional": "20/1", "decimal": 21, "capturedAt": "2026-08-04T14:00:00Z" }, "sp": null, "finishPosition": null, "resultStatus": null, "jockey": "Test Jockey G", "trainer": "Test Trainer G" },
    { "runnerNumber": 8, "name": "Fixture Pepper", "status": "runner", "odds": { "fractional": "25/1", "decimal": 26, "capturedAt": "2026-08-04T14:00:00Z" }, "sp": null, "finishPosition": null, "resultStatus": null, "jockey": "Test Jockey H", "trainer": "Test Trainer H" }
  ],
  "validation": { "status": "passed", "checks": [], "validatedAt": "2026-08-04T17:10:00Z" }
}
