{
  "raceId": "FIX-2026-08-06-FIXTON-1530-C4-TIE",
  "dataset": "test-fixture",
  "testData": true,
  "source": "test-fixture-generator",
  "sourceUrl": null,
  "retrievedAt": "2026-08-06T18:00:00Z",
  "parserVersion": "fixture-generator-1.0.0",
  "date": "2026-08-06",
  "time": "15:30",
  "course": "Fixtureton (TEST)",
  "courseRegion": "GB",
  "raceType": "Flat",
  "isHandicap": true,
  "class": 4,
  "name": "Synthetic Test Handicap (Fixture K, longshot tie-break, resolved)",
  "distance": "7f",
  "going": "Good (fixture)",
  "declaredRunners": 8,
  "actualRunners": 8,
  "resultStatus": "resolved",
  "resultsRetrievedAt": "2026-08-06T16:20:00Z",
  "runners": [
    { "runnerNumber": 1, "name": "Fixture Alder", "status": "runner", "odds": { "fractional": "2/1", "decimal": 3, "capturedAt": "2026-08-06T14:50:00Z" }, "sp": { "fractional": "2/1", "decimal": 3, "capturedAt": "2026-08-06T15:30:00Z" }, "finishPosition": 1, "resultStatus": "finished", "jockey": "Test Jockey A", "trainer": "Test Trainer A" },
    { "runnerNumber": 2, "name": "Fixture Beech", "status": "runner", "odds": { "fractional": "14/1", "decimal": 15, "capturedAt": "2026-08-06T14:50:00Z" }, "sp": { "fractional": "14/1", "decimal": 15, "capturedAt": "2026-08-06T15:30:00Z" }, "finishPosition": 2, "resultStatus": "finished", "jockey": "Test Jockey B", "trainer": "Test Trainer B" },
    { "runnerNumber": 3, "name": "Fixture Cherry", "status": "runner", "odds": { "fractional": "6/1", "decimal": 7, "capturedAt": "2026-08-06T14:50:00Z" }, "sp": { "fractional": "6/1", "decimal": 7, "capturedAt": "2026-08-06T15:30:00Z" }, "finishPosition": 4, "resultStatus": "finished", "jockey": "Test Jockey C", "trainer": "Test Trainer C" },
    { "runnerNumber": 4, "name": "Fixture Damson", "status": "runner", "odds": { "fractional": "25/1", "decimal": 26, "capturedAt": "2026-08-06T14:50:00Z" }, "sp": { "fractional": "25/1", "decimal": 26, "capturedAt": "2026-08-06T15:30:00Z" }, "finishPosition": 3, "resultStatus": "finished", "jockey": "Test Jockey D", "trainer": "Test Trainer D" },
    { "runnerNumber": 5, "name": "Fixture Elder", "status": "runner", "odds": { "fractional": "8/1", "decimal": 9, "capturedAt": "2026-08-06T14:50:00Z" }, "sp": { "fractional": "8/1", "decimal": 9, "capturedAt": "2026-08-06T15:30:00Z" }, "finishPosition": 5, "resultStatus": "finished", "jockey": "Test Jockey E", "trainer": "Test Trainer E" },
    { "runnerNumber": 6, "name": "Fixture Fig", "status": "runner", "odds": { "fractional": "14/1", "decimal": 15, "capturedAt": "2026-08-06T14:50:00Z" }, "sp": { "fractional": "14/1", "decimal": 15, "capturedAt": "2026-08-06T15:30:00Z" }, "finishPosition": 6, "resultStatus": "finished", "jockey": "Test Jockey F", "trainer": "Test Trainer F" },
    { "runnerNumber": 7, "name": "Fixture Guelder", "status": "runner", "odds": { "fractional": "16/1", "decimal": 17, "capturedAt": "2026-08-06T14:50:00Z" }, "sp": { "fractional": "16/1", "decimal": 17, "capturedAt": "2026-08-06T15:30:00Z" }, "finishPosition": 7, "resultStatus": "finished", "jockey": "Test Jockey G", "trainer": "Test Trainer G" },
    { "runnerNumber": 8, "name": "Fixture Hawthorn", "status": "runner", "odds": { "fractional": "20/1", "decimal": 21, "capturedAt": "2026-08-06T14:50:00Z" }, "sp": { "fractional": "20/1", "decimal": 21, "capturedAt": "2026-08-06T15:30:00Z" }, "finishPosition": 8, "resultStatus": "finished", "jockey": "Test Jockey H", "trainer": "Test Trainer H" }
  ],
  "validation": { "status": "passed", "checks": [], "validatedAt": "2026-08-06T18:00:00Z" }
}
