{
  "raceId": "FIX-2026-08-03-FIXBRIDGE-1400-C6-SMALL",
  "dataset": "test-fixture",
  "testData": true,
  "source": "test-fixture-generator",
  "sourceUrl": null,
  "retrievedAt": "2026-08-03T16:30:00Z",
  "parserVersion": "fixture-generator-1.0.0",
  "date": "2026-08-03",
  "time": "14:00",
  "course": "Fixbridge (TEST)",
  "courseRegion": "GB",
  "raceType": "Flat",
  "isHandicap": true,
  "class": 6,
  "name": "Synthetic Test Handicap (Fixture E, field too small after non-runner)",
  "distance": "6f",
  "going": "Good (fixture)",
  "declaredRunners": 6,
  "actualRunners": 5,
  "resultStatus": "unresolved",
  "resultsRetrievedAt": null,
  "runners": [
    { "runnerNumber": 1, "name": "Fixture Amber", "status": "runner", "odds": { "fractional": "2/1", "decimal": 3, "capturedAt": "2026-08-03T13:20:00Z" }, "sp": null, "finishPosition": null, "resultStatus": null, "jockey": "Test Jockey A", "trainer": "Test Trainer A" },
    { "runnerNumber": 2, "name": "Fixture Blaze", "status": "runner", "odds": { "fractional": "4/1", "decimal": 5, "capturedAt": "2026-08-03T13:20:00Z" }, "sp": null, "finishPosition": null, "resultStatus": null, "jockey": "Test Jockey B", "trainer": "Test Trainer B" },
    { "runnerNumber": 3, "name": "Fixture Coral", "status": "runner", "odds": { "fractional": "12/1", "decimal": 13, "capturedAt": "2026-08-03T13:20:00Z" }, "sp": null, "finishPosition": null, "resultStatus": null, "jockey": "Test Jockey C", "trainer": "Test Trainer C" },
    { "runnerNumber": 4, "name": "Fixture Dawn", "status": "runner", "odds": { "fractional": "6/1", "decimal": 7, "capturedAt": "2026-08-03T13:20:00Z" }, "sp": null, "finishPosition": null, "resultStatus": null, "jockey": "Test Jockey D", "trainer": "Test Trainer D" },
    { "runnerNumber": 5, "name": "Fixture Ember", "status": "runner", "odds": { "fractional": "16/1", "decimal": 17, "capturedAt": "2026-08-03T13:20:00Z" }, "sp": null, "finishPosition": null, "resultStatus": null, "jockey": "Test Jockey E", "trainer": "Test Trainer E" },
    { "runnerNumber": 6, "name": "Fixture Flint", "status": "non_runner", "nonRunnerReason": "Self certificate (fixture)", "odds": { "fractional": "8/1", "decimal": 9, "capturedAt": "2026-08-03T13:20:00Z" }, "sp": null, "finishPosition": null, "resultStatus": "withdrawn", "jockey": "Test Jockey F", "trainer": "Test Trainer F" }
  ],
  "validation": { "status": "passed", "checks": [], "validatedAt": "2026-08-03T16:30:00Z" }
}
