{
  "raceId": "FIX-2026-08-01-FIXTON-1410-C4",
  "dataset": "test-fixture",
  "testData": true,
  "source": "test-fixture-generator",
  "sourceUrl": null,
  "retrievedAt": "2026-08-01T17:00:00Z",
  "parserVersion": "fixture-generator-1.0.0",
  "date": "2026-08-01",
  "time": "14:10",
  "course": "Fixtureton (TEST)",
  "courseRegion": "GB",
  "raceType": "Flat",
  "isHandicap": true,
  "class": 4,
  "name": "Synthetic Test Handicap (Fixture A)",
  "distance": "1m",
  "going": "Good (fixture)",
  "declaredRunners": 8,
  "actualRunners": 8,
  "resultStatus": "resolved",
  "resultsRetrievedAt": "2026-08-01T15:00:00Z",
  "runners": [
    { "runnerNumber": 1, "name": "Fixture Alpha", "status": "runner", "odds": { "fractional": "6/4", "decimal": 2.5, "capturedAt": "2026-08-01T13:30:00Z" }, "sp": { "fractional": "6/4", "decimal": 2.5, "capturedAt": "2026-08-01T14:10:00Z" }, "finishPosition": 3, "resultStatus": "finished", "jockey": "Test Jockey A", "trainer": "Test Trainer A" },
    { "runnerNumber": 2, "name": "Fixture Bravo", "status": "runner", "odds": { "fractional": "4/1", "decimal": 5, "capturedAt": "2026-08-01T13:30:00Z" }, "sp": { "fractional": "4/1", "decimal": 5, "capturedAt": "2026-08-01T14:10:00Z" }, "finishPosition": 5, "resultStatus": "finished", "jockey": "Test Jockey B", "trainer": "Test Trainer B" },
    { "runnerNumber": 3, "name": "Fixture Charlie", "status": "runner", "odds": { "fractional": "12/1", "decimal": 13, "capturedAt": "2026-08-01T13:30:00Z" }, "sp": { "fractional": "12/1", "decimal": 13, "capturedAt": "2026-08-01T14:10:00Z" }, "finishPosition": 1, "resultStatus": "finished", "jockey": "Test Jockey C", "trainer": "Test Trainer C" },
    { "runnerNumber": 4, "name": "Fixture Delta", "status": "runner", "odds": { "fractional": "6/1", "decimal": 7, "capturedAt": "2026-08-01T13:30:00Z" }, "sp": { "fractional": "6/1", "decimal": 7, "capturedAt": "2026-08-01T14:10:00Z" }, "finishPosition": 2, "resultStatus": "finished", "jockey": "Test Jockey D", "trainer": "Test Trainer D" },
    { "runnerNumber": 5, "name": "Fixture Echo", "status": "runner", "odds": { "fractional": "16/1", "decimal": 17, "capturedAt": "2026-08-01T13:30:00Z" }, "sp": { "fractional": "16/1", "decimal": 17, "capturedAt": "2026-08-01T14:10:00Z" }, "finishPosition": 4, "resultStatus": "finished", "jockey": "Test Jockey E", "trainer": "Test Trainer E" },
    { "runnerNumber": 6, "name": "Fixture Foxtrot", "status": "runner", "odds": { "fractional": "8/1", "decimal": 9, "capturedAt": "2026-08-01T13:30:00Z" }, "sp": { "fractional": "8/1", "decimal": 9, "capturedAt": "2026-08-01T14:10:00Z" }, "finishPosition": 6, "resultStatus": "finished", "jockey": "Test Jockey F", "trainer": "Test Trainer F" },
    { "runnerNumber": 7, "name": "Fixture Golf", "status": "runner", "odds": { "fractional": "20/1", "decimal": 21, "capturedAt": "2026-08-01T13:30:00Z" }, "sp": { "fractional": "20/1", "decimal": 21, "capturedAt": "2026-08-01T14:10:00Z" }, "finishPosition": 7, "resultStatus": "finished", "jockey": "Test Jockey G", "trainer": "Test Trainer G" },
    { "runnerNumber": 8, "name": "Fixture Hotel", "status": "runner", "odds": { "fractional": "9/1", "decimal": 10, "capturedAt": "2026-08-01T13:30:00Z" }, "sp": { "fractional": "9/1", "decimal": 10, "capturedAt": "2026-08-01T14:10:00Z" }, "finishPosition": 8, "resultStatus": "finished", "jockey": "Test Jockey H", "trainer": "Test Trainer H" }
  ],
  "validation": { "status": "passed", "checks": [], "validatedAt": "2026-08-01T17:00:00Z" }
}
