{
  "raceId": "FIX-2026-08-07-FIXTON-1540-C4-MISSINGODDS",
  "dataset": "test-fixture",
  "testData": true,
  "source": "test-fixture-generator",
  "sourceUrl": null,
  "retrievedAt": "2026-08-07T17:30:00Z",
  "parserVersion": "fixture-generator-1.0.0",
  "date": "2026-08-07",
  "time": "15:40",
  "course": "Fixtureton (TEST)",
  "courseRegion": "GB",
  "raceType": "Flat",
  "isHandicap": true,
  "class": 4,
  "name": "Synthetic Test Handicap (Fixture L, one runner without odds)",
  "distance": "1m",
  "going": "Good (fixture)",
  "declaredRunners": 8,
  "actualRunners": 8,
  "resultStatus": "unresolved",
  "resultsRetrievedAt": null,
  "runners": [
    { "runnerNumber": 1, "name": "Fixture Angelica", "status": "runner", "odds": { "fractional": "5/2", "decimal": 3.5, "capturedAt": "2026-08-07T15:00:00Z" }, "sp": null, "finishPosition": null, "resultStatus": null, "jockey": "Test Jockey A", "trainer": "Test Trainer A" },
    { "runnerNumber": 2, "name": "Fixture Basil", "status": "runner", "odds": { "fractional": "4/1", "decimal": 5, "capturedAt": "2026-08-07T15:00:00Z" }, "sp": null, "finishPosition": null, "resultStatus": null, "jockey": "Test Jockey B", "trainer": "Test Trainer B" },
    { "runnerNumber": 3, "name": "Fixture Chive", "status": "runner", "odds": null, "sp": null, "finishPosition": null, "resultStatus": null, "jockey": "Test Jockey C", "trainer": "Test Trainer C" },
    { "runnerNumber": 4, "name": "Fixture Dill", "status": "runner", "odds": { "fractional": "6/1", "decimal": 7, "capturedAt": "2026-08-07T15:00:00Z" }, "sp": null, "finishPosition": null, "resultStatus": null, "jockey": "Test Jockey D", "trainer": "Test Trainer D" },
    { "runnerNumber": 5, "name": "Fixture Fennel", "status": "runner", "odds": { "fractional": "16/1", "decimal": 17, "capturedAt": "2026-08-07T15:00:00Z" }, "sp": null, "finishPosition": null, "resultStatus": null, "jockey": "Test Jockey E", "trainer": "Test Trainer E" },
    { "runnerNumber": 6, "name": "Fixture Ginger", "status": "runner", "odds": { "fractional": "8/1", "decimal": 9, "capturedAt": "2026-08-07T15:00:00Z" }, "sp": null, "finishPosition": null, "resultStatus": null, "jockey": "Test Jockey F", "trainer": "Test Trainer F" },
    { "runnerNumber": 7, "name": "Fixture Horseradish", "status": "runner", "odds": { "fractional": "20/1", "decimal": 21, "capturedAt": "2026-08-07T15:00:00Z" }, "sp": null, "finishPosition": null, "resultStatus": null, "jockey": "Test Jockey G", "trainer": "Test Trainer G" },
    { "runnerNumber": 8, "name": "Fixture Juniper", "status": "runner", "odds": { "fractional": "25/1", "decimal": 26, "capturedAt": "2026-08-07T15:00:00Z" }, "sp": null, "finishPosition": null, "resultStatus": null, "jockey": "Test Jockey H", "trainer": "Test Trainer H" }
  ],
  "validation": { "status": "passed", "checks": [], "validatedAt": "2026-08-07T17:30:00Z" }
}
