{
  "raceId": "FIX-2026-08-05-FIXTON-1520-C1",
  "dataset": "test-fixture",
  "testData": true,
  "source": "test-fixture-generator",
  "sourceUrl": null,
  "retrievedAt": "2026-08-05T17:40:00Z",
  "parserVersion": "fixture-generator-1.0.0",
  "date": "2026-08-05",
  "time": "15:20",
  "course": "Fixtureton (TEST)",
  "courseRegion": "GB",
  "raceType": "Flat",
  "isHandicap": true,
  "class": 1,
  "name": "Synthetic Test Handicap (Fixture J, class 1 excluded)",
  "distance": "1m2f",
  "going": "Good (fixture)",
  "declaredRunners": 8,
  "actualRunners": 8,
  "resultStatus": "unresolved",
  "resultsRetrievedAt": null,
  "runners": [
    { "runnerNumber": 1, "name": "Fixture Quince", "status": "runner", "odds": { "fractional": "2/1", "decimal": 3, "capturedAt": "2026-08-05T14:40:00Z" }, "sp": null, "finishPosition": null, "resultStatus": null, "jockey": "Test Jockey A", "trainer": "Test Trainer A" },
    { "runnerNumber": 2, "name": "Fixture Rowan", "status": "runner", "odds": { "fractional": "4/1", "decimal": 5, "capturedAt": "2026-08-05T14:40:00Z" }, "sp": null, "finishPosition": null, "resultStatus": null, "jockey": "Test Jockey B", "trainer": "Test Trainer B" },
    { "runnerNumber": 3, "name": "Fixture Sorrel", "status": "runner", "odds": { "fractional": "6/1", "decimal": 7, "capturedAt": "2026-08-05T14:40:00Z" }, "sp": null, "finishPosition": null, "resultStatus": null, "jockey": "Test Jockey C", "trainer": "Test Trainer C" },
    { "runnerNumber": 4, "name": "Fixture Thistle", "status": "runner", "odds": { "fractional": "8/1", "decimal": 9, "capturedAt": "2026-08-05T14:40:00Z" }, "sp": null, "finishPosition": null, "resultStatus": null, "jockey": "Test Jockey D", "trainer": "Test Trainer D" },
    { "runnerNumber": 5, "name": "Fixture Umber", "status": "runner", "odds": { "fractional": "12/1", "decimal": 13, "capturedAt": "2026-08-05T14:40:00Z" }, "sp": null, "finishPosition": null, "resultStatus": null, "jockey": "Test Jockey E", "trainer": "Test Trainer E" },
    { "runnerNumber": 6, "name": "Fixture Violet", "status": "runner", "odds": { "fractional": "16/1", "decimal": 17, "capturedAt": "2026-08-05T14:40:00Z" }, "sp": null, "finishPosition": null, "resultStatus": null, "jockey": "Test Jockey F", "trainer": "Test Trainer F" },
    { "runnerNumber": 7, "name": "Fixture Willow", "status": "runner", "odds": { "fractional": "20/1", "decimal": 21, "capturedAt": "2026-08-05T14:40:00Z" }, "sp": null, "finishPosition": null, "resultStatus": null, "jockey": "Test Jockey G", "trainer": "Test Trainer G" },
    { "runnerNumber": 8, "name": "Fixture Yarrow", "status": "runner", "odds": { "fractional": "25/1", "decimal": 26, "capturedAt": "2026-08-05T14:40:00Z" }, "sp": null, "finishPosition": null, "resultStatus": null, "jockey": "Test Jockey H", "trainer": "Test Trainer H" }
  ],
  "validation": { "status": "passed", "checks": [], "validatedAt": "2026-08-05T17:40:00Z" }
}
