{
  "raceId": "FIX-2026-08-01-FIXTON-1510-C5-NR",
  "dataset": "test-fixture",
  "testData": true,
  "source": "test-fixture-generator",
  "sourceUrl": null,
  "retrievedAt": "2026-08-01T17:00:00Z",
  "parserVersion": "fixture-generator-1.0.0",
  "date": "2026-08-01",
  "time": "15:10",
  "course": "Fixtureton (TEST)",
  "courseRegion": "GB",
  "raceType": "Flat",
  "isHandicap": true,
  "class": 5,
  "name": "Synthetic Test Handicap (Fixture B, non-runners)",
  "distance": "1m2f",
  "going": "Good (fixture)",
  "declaredRunners": 9,
  "actualRunners": 7,
  "resultStatus": "unresolved",
  "resultsRetrievedAt": null,
  "runners": [
    { "runnerNumber": 1, "name": "Fixture India", "status": "runner", "odds": { "fractional": "5/2", "decimal": 3.5, "capturedAt": "2026-08-01T14:30:00Z" }, "sp": null, "finishPosition": null, "resultStatus": null, "jockey": "Test Jockey A", "trainer": "Test Trainer A" },
    { "runnerNumber": 2, "name": "Fixture Juliet", "status": "non_runner", "nonRunnerReason": "Vet's certificate (fixture)", "odds": { "fractional": "2/1", "decimal": 3, "capturedAt": "2026-08-01T14:30:00Z" }, "sp": null, "finishPosition": null, "resultStatus": "withdrawn", "jockey": "Test Jockey B", "trainer": "Test Trainer B" },
    { "runnerNumber": 3, "name": "Fixture Kilo", "status": "runner", "odds": { "fractional": "100/30", "decimal": 4.3333, "capturedAt": "2026-08-01T14:30:00Z" }, "sp": null, "finishPosition": null, "resultStatus": null, "jockey": "Test Jockey C", "trainer": "Test Trainer C" },
    { "runnerNumber": 4, "name": "Fixture Lima", "status": "runner", "odds": { "fractional": "10/1", "decimal": 11, "capturedAt": "2026-08-01T14:30:00Z" }, "sp": null, "finishPosition": null, "resultStatus": null, "jockey": "Test Jockey D", "trainer": "Test Trainer D" },
    { "runnerNumber": 5, "name": "Fixture Mike", "status": "runner", "odds": { "fractional": "7/2", "decimal": 4.5, "capturedAt": "2026-08-01T14:30:00Z" }, "sp": null, "finishPosition": null, "resultStatus": null, "jockey": "Test Jockey E", "trainer": "Test Trainer E" },
    { "runnerNumber": 6, "name": "Fixture November", "status": "runner", "odds": { "fractional": "14/1", "decimal": 15, "capturedAt": "2026-08-01T14:30:00Z" }, "sp": null, "finishPosition": null, "resultStatus": null, "jockey": "Test Jockey F", "trainer": "Test Trainer F" },
    { "runnerNumber": 7, "name": "Fixture Oscar", "status": "runner", "odds": { "fractional": "8/1", "decimal": 9, "capturedAt": "2026-08-01T14:30:00Z" }, "sp": null, "finishPosition": null, "resultStatus": null, "jockey": "Test Jockey G", "trainer": "Test Trainer G" },
    { "runnerNumber": 8, "name": "Fixture Papa", "status": "runner", "odds": { "fractional": "25/1", "decimal": 26, "capturedAt": "2026-08-01T14:30:00Z" }, "sp": null, "finishPosition": null, "resultStatus": null, "jockey": "Test Jockey H", "trainer": "Test Trainer H" },
    { "runnerNumber": 9, "name": "Fixture Quebec", "status": "non_runner", "nonRunnerReason": "Going unsuitable (fixture)", "odds": { "fractional": "20/1", "decimal": 21, "capturedAt": "2026-08-01T14:30:00Z" }, "sp": null, "finishPosition": null, "resultStatus": "withdrawn", "jockey": "Test Jockey I", "trainer": "Test Trainer I" }
  ],
  "validation": { "status": "passed", "checks": [], "validatedAt": "2026-08-01T17:00:00Z" }
}
