{
  "raceId": "FIX-2026-08-03-FIXBRIDGE-1500-C2-LARGE",
  "dataset": "test-fixture",
  "testData": true,
  "source": "test-fixture-generator",
  "sourceUrl": null,
  "retrievedAt": "2026-08-03T17:30:00Z",
  "parserVersion": "fixture-generator-1.0.0",
  "date": "2026-08-03",
  "time": "15:00",
  "course": "Fixbridge (TEST)",
  "courseRegion": "GB",
  "raceType": "Flat",
  "isHandicap": true,
  "class": 2,
  "name": "Synthetic Test Handicap (Fixture F, field too large)",
  "distance": "1m4f",
  "going": "Good (fixture)",
  "declaredRunners": 13,
  "actualRunners": 13,
  "resultStatus": "unresolved",
  "resultsRetrievedAt": null,
  "runners": [
    { "runnerNumber": 1, "name": "Fixture Garnet", "status": "runner", "odds": { "fractional": "5/2", "decimal": 3.5, "capturedAt": "2026-08-03T14:20:00Z" }, "sp": null, "finishPosition": null, "resultStatus": null, "jockey": "Test Jockey A", "trainer": "Test Trainer A" },
    { "runnerNumber": 2, "name": "Fixture Hazel", "status": "runner", "odds": { "fractional": "4/1", "decimal": 5, "capturedAt": "2026-08-03T14:20:00Z" }, "sp": null, "finishPosition": null, "resultStatus": null, "jockey": "Test Jockey B", "trainer": "Test Trainer B" },
    { "runnerNumber": 3, "name": "Fixture Iris", "status": "runner", "odds": { "fractional": "6/1", "decimal": 7, "capturedAt": "2026-08-03T14:20:00Z" }, "sp": null, "finishPosition": null, "resultStatus": null, "jockey": "Test Jockey C", "trainer": "Test Trainer C" },
    { "runnerNumber": 4, "name": "Fixture Jade", "status": "runner", "odds": { "fractional": "8/1", "decimal": 9, "capturedAt": "2026-08-03T14:20:00Z" }, "sp": null, "finishPosition": null, "resultStatus": null, "jockey": "Test Jockey D", "trainer": "Test Trainer D" },
    { "runnerNumber": 5, "name": "Fixture Kite", "status": "runner", "odds": { "fractional": "10/1", "decimal": 11, "capturedAt": "2026-08-03T14:20:00Z" }, "sp": null, "finishPosition": null, "resultStatus": null, "jockey": "Test Jockey E", "trainer": "Test Trainer E" },
    { "runnerNumber": 6, "name": "Fixture Lark", "status": "runner", "odds": { "fractional": "12/1", "decimal": 13, "capturedAt": "2026-08-03T14:20:00Z" }, "sp": null, "finishPosition": null, "resultStatus": null, "jockey": "Test Jockey F", "trainer": "Test Trainer F" },
    { "runnerNumber": 7, "name": "Fixture Moss", "status": "runner", "odds": { "fractional": "14/1", "decimal": 15, "capturedAt": "2026-08-03T14:20:00Z" }, "sp": null, "finishPosition": null, "resultStatus": null, "jockey": "Test Jockey G", "trainer": "Test Trainer G" },
    { "runnerNumber": 8, "name": "Fixture Night", "status": "runner", "odds": { "fractional": "16/1", "decimal": 17, "capturedAt": "2026-08-03T14:20:00Z" }, "sp": null, "finishPosition": null, "resultStatus": null, "jockey": "Test Jockey H", "trainer": "Test Trainer H" },
    { "runnerNumber": 9, "name": "Fixture Opal", "status": "runner", "odds": { "fractional": "20/1", "decimal": 21, "capturedAt": "2026-08-03T14:20:00Z" }, "sp": null, "finishPosition": null, "resultStatus": null, "jockey": "Test Jockey I", "trainer": "Test Trainer I" },
    { "runnerNumber": 10, "name": "Fixture Pearl", "status": "runner", "odds": { "fractional": "25/1", "decimal": 26, "capturedAt": "2026-08-03T14:20:00Z" }, "sp": null, "finishPosition": null, "resultStatus": null, "jockey": "Test Jockey J", "trainer": "Test Trainer J" },
    { "runnerNumber": 11, "name": "Fixture Quartz", "status": "runner", "odds": { "fractional": "33/1", "decimal": 34, "capturedAt": "2026-08-03T14:20:00Z" }, "sp": null, "finishPosition": null, "resultStatus": null, "jockey": "Test Jockey K", "trainer": "Test Trainer K" },
    { "runnerNumber": 12, "name": "Fixture Rose", "status": "runner", "odds": { "fractional": "40/1", "decimal": 41, "capturedAt": "2026-08-03T14:20:00Z" }, "sp": null, "finishPosition": null, "resultStatus": null, "jockey": "Test Jockey L", "trainer": "Test Trainer L" },
    { "runnerNumber": 13, "name": "Fixture Slate", "status": "runner", "odds": { "fractional": "50/1", "decimal": 51, "capturedAt": "2026-08-03T14:20:00Z" }, "sp": null, "finishPosition": null, "resultStatus": null, "jockey": "Test Jockey M", "trainer": "Test Trainer M" }
  ],
  "validation": { "status": "passed", "checks": [], "validatedAt": "2026-08-03T17:30:00Z" }
}
